钱文江,北京,东城,北京医院,外科,整形外科,主治医师,,3.2,1407,个性化精细眼综合整形美容（包括双眼皮、内外眼角、眼睑下至和眼袋），疑难眼整形修复，各种鼻、耳、颏区精细美容手术，面部年轻化综合治疗，形体雕塑手术，外阴生殖器整形，腋臭根治及男性乳腺发育矫治，各种创伤后疤痕细致修复等．,"1,951,673次",9篇,1407位,0位,4位,,,
任荣鑫,北京,东城,北京医院,外科,整形外科,主治医师,,3.1,286,1、应用皮秒激光治疗各种色素性疾病如太田痣、雀斑、老年斑、褐青斑、咖啡斑、纹身。 2、血管性疾病：鲜红斑痣、毛细血管扩张、血管痣、酒糟鼻等。3、全身各部位永久脱毛。4、各种瘢痕的综合治疗（痤疮瘢痕、外伤后瘢痕）5、面部年轻化的综合治疗：射频紧肤等。,"197,150次",7篇,286位,144位,145位,,,
孙中泱,北京,东城,北京医院,外科,整形外科,住院医师,,3.0,,面部年轻化，眼鼻整形等,"4,309次",0篇,0位,0位,0位,,,
王怀斌,北京,东城,北京医院,外科,心血管外科,主任医师,副教授,3.9,356,①冠心病(胸闷，憋气，胸痛)：微创心脏不停跳、小切口及全动脉化等多种术式冠状动脉搭桥手术;②心脏瓣膜病(二尖瓣狭窄，二尖瓣返流，二尖瓣关闭不全，主动脉瓣狭窄，主动脉瓣关闭不全，主动脉瓣返流)：瓣膜修复成形及置换手术;③成人先天性心脏病矫治手术及微创介入封堵治疗房间隔缺损、动脉导管未闭及卵圆孔未闭;④胸主动脉瘤及主动脉夹层手术治疗⑤微创不开胸经导管主动脉瓣置换术,"246,538次",51篇,356位,269位,272位,2,280例,215例
甄文俊,北京,东城,北京医院,外科,心血管外科,主任医师,教授,3.5,,冠脉搭桥治疗冠心病，心脏瓣膜病、先天性心脏病、大血管疾病等，肺癌、食管贲门癌、纵隔肿瘤等的手术治疗及综合治疗,,,,,,,,
欧阳小康,北京,东城,北京医院,外科,心血管外科,副主任医师,,3.2,2,主治疾病包括各种先天性心脏病，心脏瓣膜疾病，冠心病，大血管病及外周血管闭塞性疾病,"36,397次",0篇,2位,0位,0位,,,
罗文琦,北京,东城,北京医院,外科,心血管外科,副主任医师,讲师,3.2,89,冠心病，瓣膜病，主动脉根部病变，心房颤动等,"319,796次",9篇,89位,0位,1位,,,
王子,北京,东城,北京医院,外科,心血管外科,主治医师,,3.1,,,,,,,,,,
钟鹏,北京,东城,北京医院,外科,心血管外科,住院医师,,2.8,,心血管疾病,"8,348次",0篇,0位,0位,0位,,,
华彬,北京,东城,北京医院,外科,乳腺外科,主任医师,副教授,3.3,524,乳腺良性肿物的外科治疗；乳腺癌根治术、保乳手术、前哨淋巴结活检；钙化灶定位切除，乳腺导管内窥镜检查等。,"459,700次",5篇,524位,0位,2位,,,
吕秋波,北京,东城,北京医院,妇儿,妇产科,主任医师,,3.3,1889,妇科良恶性肿瘤的诊断及治疗；妇科微创手术，其中包括阴式全子宫切除术、腹腔镜下及阴式子宫肌瘤剔除术、妇科腹腔镜手术；B超引导下盆腔妇科囊肿穿刺术,"1,438,485次",0篇,1889位,1位,9位,,,
吴宜勇,北京,东城,北京医院,妇儿,妇产科,主任医师,教授,3.5,4,生殖内分泌、围绝经期及绝经期妇科相关疾病的防治,"70,172次",0篇,4位,0位,2位,,,
王少为,北京,东城,北京医院,妇儿,妇产科,主任医师,教授,3.4,,围产医学各类疾病的诊治，在产科复杂并发症、难产处理、产科危重症抢救、宫颈机能不良的诊断与治疗、遗传咨询等方面具有丰富的临床经验。,"322,944次",0篇,0位,0位,0位,,,
李叶,北京,东城,北京医院,妇儿,妇产科,主任医师,副教授,3.4,,妇科肿瘤，女性盆底功能障碍性疾病，妇科老年病。,,,,,,,,
罗立华,北京,东城,北京医院,妇儿,妇产科,主任医师,副教授,3.4,,对妇科肿瘤、不孕症、习惯性流产及高危妊娠的诊治方面具有丰富的临床经验,"3,755次",0篇,0位,0位,0位,,,
段素欣,北京,东城,北京医院,妇儿,妇产科,主任医师,教授,3.4,,在次广泛及广泛性子宫切除淋巴结清扫术、卵巢癌根治术、子宫内膜异位症、粘连性子宫切除、阴式子宫切除术、产科子宫切除术、剖腹产同时子宫肌瘤剔除术、输卵管矫形及复通术有独特的建树,,,,,,,,
申桂华,北京,东城,北京医院,妇儿,妇产科,主任医师,,3.3,,宫颈及性传播疾病，月经不调，妇科恶性肿瘤的化疗、妊娠期糖尿病,,,,,,,,
邓文慧,北京,东城,北京医院,妇儿,妇产科,主任医师,副教授,3.3,,月经异常的诊治，更年期相关问题的处理，不孕及先兆流产的防治，多囊卵巢综合征的诊治，盆底子宫脱垂、尿失禁等的诊治，子宫内膜异位症、子宫肌瘤及宫颈病变、子宫内膜癌的诊治。,,,,,,,,
崔颖,北京,东城,北京医院,妇儿,妇产科,主任医师,,3.3,129,擅长各种阴道炎、盆腔炎症、宫颈癌前病变、宫颈癌、子宫内膜异位症、卵巢囊肿、卵巢癌、子宫肌瘤、子宫内膜息肉、子宫内膜增生、子宫内膜癌等病变。,"64,819次",0篇,129位,0位,0位,,,
赵晓东,北京,东城,北京医院,妇儿,妇产科,主任医师,,3.3,376,各种阴式手术、各种腹腔镜手术、各种妇科恶性肿瘤根治术、宫颈癌前病变（CIN）的诊断和处理、LEEP手术、以及妇科恶性肿瘤化疗,"893,092次",5篇,376位,0位,0位,,,
张巧,北京,东城,北京医院,妇儿,妇产科,主任医师,,3.3,,熟练掌握妇产科疾病的诊断、治疗，以及妇产科B超检查技术；在产前筛查、高危妊娠的诊治以及难产的处理方面具有丰富的经验；在围绝经期的综合征、月经不调、抑郁症、肿瘤以及绝经后骨质疏松、老年性痴呆等疾病的治疗和预防方面积累了一定的经验。善于应用超声及妇科内窥镜技术诊治宫颈病变 子宫内膜病变、子宫肌瘤及卵巢肿瘤 子宫内膜异位症，注重妇产科微创性手术,,,,,,,,
孟庆伟,北京,东城,北京医院,妇儿,妇产科,主任医师,,3.3,12,子宫肌瘤、子宫内膜异位症的微创治疗；盆腔脏器脱垂疾病、宫颈病变及不孕症的诊治。在不孕症的诊治方面具有独特的方法并有丰富的临床经验,"68,706次",0篇,12位,0位,4位,,,
魏风华,北京,东城,北京医院,妇儿,妇产科,主任医师,,3.3,,妇科常见病的诊断、治疗及妇科疑难病症的诊疗。妇科肿瘤的诊断、治疗及子宫内膜异位症的诊疗,,,,,,,,
李旻,北京,东城,北京医院,妇儿,妇产科,副主任医师,副教授,3.3,1,妇产科疾病,"33,828次",0篇,1位,0位,0位,,,
张毅,北京,东城,北京医院,妇儿,妇产科,主任医师,,3.3,,腹膜外淋巴结清扫的方法；子宫广泛切除术；改进阴式全子宫切除术方法；阴式子宫肌瘤剔除术,,,,,,,,
万理,北京,东城,北京医院,妇儿,妇产科,主任医师,,3.2,,在新生儿、儿科急救领域有较为深入的研究,,,,,,,,
李寒松,北京,东城,北京医院,妇儿,妇产科,主任医师,,3.2,,妇科恶性肿瘤及盆底功能障碍性疾病的诊治，包括宫颈癌、子宫内膜癌、卵巢癌及盆底器官脱垂（子宫脱垂、膀胱及直肠膨出、压力性尿失禁）的诊断、预防及手术治疗。,,,,,,,,
周丹,北京,东城,北京医院,妇儿,妇产科,副主任医师,讲师,3.2,,妇科肿瘤，妇科炎症，不孕症，计划生育,"9,947次",0篇,0位,0位,0位,,,
李江红,北京,东城,北京医院,妇儿,妇产科,副主任医师,,3.2,17,产前诊断，优生优育、遗传咨询，各种妇科内分泌疾病：不孕症、复发性流产、围绝经期综合征、异常子宫出血等。,"29,533次",31篇,17位,0位,0位,,,
邓朝英,北京,东城,北京医院,妇儿,妇产科,主任医师,,3.2,,妇科，子宫内膜异位症、老年病和肿瘤等，各种妇科腹部及阴道手术,,,,,,,,
杜影芬,北京,东城,北京医院,妇儿,妇产科,主任医师,,3.2,,妇产科和计划生育,,,,,,,,
黄帅,北京,东城,北京医院,妇儿,妇产科,副主任医师,,3.2,,妇产科常见疾病,,,,,,,,
伍凤莉,北京,东城,北京医院,妇儿,妇产科,副主任医师,,3.2,,妇科宫腔镜手术、腹腔镜手术、阴式手术等。,,,,,,,,
惠英,北京,东城,北京医院,妇儿,妇产科,副主任医师,,3.2,916,各种妇产科疾病、妇科内分泌，多囊卵巢综合症，功血，更年期管理，妊娠期及产后甲状腺疾病，孕产期管理，宫颈病变,"656,941次",0篇,916位,70位,71位,,,
齐伟宏,北京,东城,北京医院,妇儿,妇产科,副主任医师,,3.2,,妇产科常见病、多发病的诊治，对于妊娠诊断、先兆流产的预防诊治有深入研究，对于宫颈病变诊治有独到见解，对于多囊卵巢综合症的诊治及远期并发症的预防有深入研究。,,,,,,,,
姜展红,北京,东城,北京医院,妇儿,妇产科,副主任医师,,3.2,,妇科疾病,,,,,,,,
毛滢,北京,东城,北京医院,妇儿,妇产科,副主任医师,,3.2,,妊娠并发症与合并症，妇科宫颈疾病及妇科常见疾病的诊断和处理。,,,,,,,,
赵学英,北京,东城,北京医院,妇儿,妇产科,副主任医师,,3.2,,,,,,,,,,
李炜,北京,东城,北京医院,妇儿,妇产科,主治医师,,3.1,,,,,,,,,,
张俊荣,北京,东城,北京医院,妇儿,妇产科,主治医师,,3.1,,,,,,,,,,
智明春,北京,东城,北京医院,妇儿,妇产科,主治医师,,3.1,,,,,,,,,,
梁琳,北京,东城,北京医院,妇儿,妇产科,主治医师,,3.1,,,,,,,,,,
吕爱明,北京,东城,北京医院,妇儿,妇产科,主治医师,,3.1,,,,,,,,,,
张思辰,北京,东城,北京医院,妇儿,妇产科,主治医师,,3.1,1,妇科常见疾病诊治,,0篇,0位,0位,0位,,,
闫菊,北京,东城,北京医院,妇儿,妇产科,住院医师,,3.1,,,,,,,,,,
尚志远,北京,东城,北京医院,妇儿,妇产科,住院医师,,3.1,25,妇产科常见疾病,704次,0篇,25位,0位,0位,,,
陆支越,北京,东城,北京医院,其他,口腔科,主任医师,,3.3,,固定修复、美学修复和数字化修复。,,,,,,,,
戴永雨,北京,东城,北京医院,其他,口腔科,主任医师,教授,3.5,98,口腔颌面外科、口腔种植手术、口腔常见疾病的治疗,"236,052次",2篇,98位,0位,0位,,,
吴新建,北京,东城,北京医院,其他,口腔科,主任医师,,3.3,,口腔内科、修复科等各种病症的门诊治疗,,,,,,,,
郭子杰,北京,东城,北京医院,其他,口腔科,主任医师,,3.3,,老年人口腔疾病的综合系统治疗，口腔固定、活动义齿修复。,,,,,,,,
张玉幸,北京,东城,北京医院,其他,口腔科,主任医师,,3.3,5,牙体、牙髓疾病、冠桥修复、拔牙以及口腔科常见疾病的治疗,"14,951次",0篇,5位,0位,0位,,,
刘文斌,北京,东城,北京医院,其他,口腔科,主任医师,,3.3,,口腔基础疾病综合治疗，种植牙修复、老年口腔疾病治疗与义齿修复。,,,,,,,,
蔡业军,北京,东城,北京医院,其他,口腔科,主任医师,,3.3,,口腔颌面部肿瘤手术治疗、骨量不足的植骨种植技术、种植美学修复。,,,,,,,,
金建秋,北京,东城,北京医院,其他,口腔科,副主任医师,,3.3,4195,口腔溃疡，扁平苔藓，白斑，光动力疗法。,"6,313,315次",12篇,4195位,1位,4位,,,
杨泓,北京,东城,北京医院,其他,口腔科,主任医师,,3.3,11,中重度牙周炎及侵袭性牙周炎的综合治疗、牙周冠延长、翻瓣手术治疗、牙周再生性治疗、牙龈退缩的美学治疗、牙周种植及种植体维护的治疗。,"1,145次",17篇,11位,0位,0位,,,
姜毅,北京,东城,北京医院,其他,口腔科,主任医师,,3.3,,拔牙、补牙、镶牙,,,,,,,,
张津京,北京,东城,北京医院,其他,口腔科,副主任医师,讲师,3.3,37,口腔修复，种植修复、口腔综合治疗等。,"23,157次",2篇,37位,30位,30位,,,
叶鹏,北京,东城,北京医院,其他,口腔科,主治医师,,3.3,164,微创智齿拔除，种植牙外科及修复，颌面肿瘤。,"128,542次",4篇,164位,43位,45位,,,
张廷发,北京,东城,北京医院,其他,口腔科,主任医师,,3.3,,拔牙，补牙，镶牙,,,,,,,,
李行懿,北京,东城,北京医院,其他,口腔科,副主任医师,,3.3,,牙周组织疾病的诊断与治疗，常规牙周手术治疗。,,,,,,,,
林南雁,北京,东城,北京医院,其他,口腔科,副主任医师,,3.2,,牙体牙髓专业疑难病例的诊断及其治疗。一次性根管治疗。复杂根管的治疗。,,,,,,,,
宋维来,北京,东城,北京医院,其他,口腔科,主治医师,,3.2,,口腔修复,,,,,,,,
刘聪,北京,东城,北京医院,其他,口腔科,副主任医师,,3.2,,口腔修复,,,,,,,,
张思思,北京,东城,北京医院,其他,口腔科,主治医师,,3.2,1,牙槽外科，颌面外科常见疾病的诊治,"11,653次",0篇,1位,0位,0位,,,
白欣,北京,东城,北京医院,其他,口腔科,主治医师,,3.2,,口内、外及口腔修复,,,,,,,,
任彦霞,北京,东城,北京医院,其他,口腔科,主治医师,,3.2,,,,,,,,,,
朱姗姗,北京,东城,北京医院,其他,口腔科,主治医师,,3.2,,,,,,,,,,
沈恩龙,北京,东城,北京医院,其他,口腔科,主治医师,,3.2,,拔牙、种牙,"18,243次",0篇,0位,0位,0位,,,
王爽,北京,东城,北京医院,其他,口腔科,住院医师,,3.1,,,,,,,,,,
李澍,北京,东城,北京医院,其他,口腔科,住院医师,,2.9,,,,,,,,,,
杨一帆,北京,东城,北京医院,其他,口腔科,住院医师,,2.8,,,,,,,,,,
程喆,北京,东城,北京医院,其他,口腔科,住院医师,,2.8,,,,,,,,,,
王倩,北京,东城,北京医院,其他,口腔科,住院医师,,2.8,,,,,,,,,,
樊壮壮,北京,东城,北京医院,其他,口腔科,住院医师,,2.8,,,,,,,,,,
喻晓兵,北京,东城,北京医院,其他,眼科,主任医师,,4.0,6506,微创玻璃体切除联合白内障超声乳化治疗黄斑前膜，黄斑裂孔、增殖性糖尿病视网膜病变，视网膜脱离、玻璃体积血、玻璃体混浊。此外，还有中渗、老年黄斑变性、黄斑水肿、高度近视眼底病变、中浆，视神经疾病、青光眼，白内障等。,"5,799,645次",75篇,6506位,916位,957位,2,1764例,906例
戴虹,北京,东城,北京医院,其他,眼科,主任医师,教授,3.6,506,对视网膜脱离、眼外伤、糖尿病视网膜病变、黄斑裂孔、黄斑区增殖膜等手术具有丰富的经验,"458,956次",6篇,506位,10位,24位,,,
夏群,北京,东城,北京医院,其他,眼科,主任医师,,3.5,48,屈光、眼肌、弱视、神经眼科疾患及小儿眼科疾患的诊治,"46,790次",0篇,48位,11位,11位,,,
郭晓萍,北京,东城,北京医院,其他,眼科,主任医师,,3.4,156,白内障，准分子激光屈光手术，青光眼，葡萄膜炎。,"127,656次",0篇,156位,69位,69位,,,
陈彤,北京,东城,北京医院,其他,眼科,主任医师,副教授,3.4,,老年性白内障及玻璃体视网膜疾病的诊断与手术治疗,,,,,,,,
师自安,北京,东城,北京医院,其他,眼科,主任医师,,3.4,16,糖尿病和高血压性视网膜病变、视网膜脱离、黄斑部病变等眼底病的诊断、激光治疗和玻璃体视网膜手术，青光眼的诊断治疗以及白内障超声乳化和复杂白内障的手术等,,0篇,0位,0位,2位,,,
曹群,北京,东城,北京医院,其他,眼科,主任医师,,3.4,,对各种特殊及复杂的白内障手术、抗青光眼术后的白内障手术有丰富的临床处理经验,,,,,,,,
李永,北京,东城,北京医院,其他,眼科,主任医师,,3.3,,对于各种常见眼科疾病的诊断与治疗有独特见解；应用眼科先进的诊断治疗技术如对于OCT（光学相干断层扫描）的临床应用及功能挖掘，使得很多难以诊断的眼底疾病得以及早确诊并得到及时准确的治疗；在青光眼的手术中应用特殊的可调整缝线使得手术并发症大大减少。特别是对于糖尿病性视网膜病变的早期诊断以及早期治疗具有很丰富的临床经验，使得很多糖尿病患者能够较早的开始对眼底并发症引起重视，在视力还无明显下降时得到适当的治疗；对于高血压高血脂动脉硬化引起的视网膜出血的诊断与治疗也有较为丰富的经验,,,,,,,,
高岩,北京,东城,北京医院,其他,眼科,主任医师,,3.3,,白内障的临床治疗及老年人眼屈光的研究,,,,,,,,
王铮,北京,东城,北京医院,其他,眼科,副主任医师,,3.3,23,青光眼、白内障的诊断、治疗；泪道疾病的诊断、治疗,"83,785次",0篇,23位,9位,9位,,,
卢颖毅,北京,东城,北京医院,其他,眼科,副主任医师,,3.3,,眼底病的诊断和治疗、眼底激光,,,,,,,,
狄雅芬,北京,东城,北京医院,其他,眼科,主任医师,,3.3,7,眼科疑难病的诊治,"36,323次",0篇,7位,0位,0位,,,
李晓宇,北京,东城,北京医院,其他,眼科,副主任医师,,3.3,8,青光眼、白内障,"33,925次",0篇,8位,3位,3位,,,
王震,北京,东城,北京医院,其他,眼科,副主任医师,,3.2,22,白内障屈光专业，同时对青光眼和眼科整形专业也有较深的造诣,"97,952次",0篇,22位,3位,4位,,,
杨建,北京,东城,北京医院,其他,眼科,主治医师,,3.2,,,,,,,,,,
卢光,北京,东城,北京医院,其他,眼科,主治医师,,3.2,,白内障，青光眼等眼前节疾病的诊治,,,,,,,,
赵晶,北京,东城,北京医院,其他,眼科,主治医师,,3.2,,眼科超声生物显微镜的临床应用及玻璃体手术后切口并发症的预防评估,,,,,,,,
王笑雄,北京,东城,北京医院,其他,眼科,主治医师,,3.2,,对眼科白内障、青光眼等常见病、多发病能够熟练掌握及处理,,,,,,,,
李明顺,北京,东城,北京医院,其他,眼科,主治医师,,3.2,5,"准分子激光手术,屈光不正,干眼征,角膜病","35,878次",0篇,5位,3位,3位,,,
王湘燕,北京,东城,北京医院,其他,眼科,主治医师,,3.2,,,,,,,,,,
王越倩,北京,东城,北京医院,其他,眼科,主治医师,,3.2,,斜视，弱视,"10,510次",0篇,0位,0位,0位,,,
黄辰晔,北京,东城,北京医院,其他,眼科,主治医师,,3.2,,,,,,,,,,
李康,北京,东城,北京医院,其他,眼科,主治医师,,3.2,,,14次,0篇,0位,0位,0位,,,
黄剑锋,北京,东城,北京医院,其他,眼科,主治医师,,3.2,,,,,,,,,,
谷潇雅,北京,东城,北京医院,其他,眼科,副主任医师,,3.0,6,湿性年龄相关性黄斑变性、糖尿病视网膜病变、视网膜静脉阻塞等眼底病的诊治,917次,1篇,6位,3位,3位,,,
于天,北京,东城,北京医院,其他,眼科,住院医师,,2.9,1,白内障，眼底病，角膜病变等,,0篇,0位,0位,0位,,,
李琳,北京,东城,北京医院,其他,肿瘤内科,主任医师,副教授,3.5,2,肺癌诊断治疗，给予患者规范治疗下的个体化精准治疗，以及多学科全程管理。,"45,929次",0篇,2位,0位,0位,,,
张永强,北京,东城,北京医院,其他,肿瘤内科,主任医师,副教授,3.4,104,实体肿瘤（乳腺癌、肺癌、大肠癌、胃癌、肝癌、泌尿生殖系统肿瘤等）的化疗、靶向治疗、内分泌治疗、免疫治疗等积累了丰富的经验。,,0篇,0位,0位,0位,,,
程刚,北京,东城,北京医院,其他,肿瘤内科,主任医师,,3.3,,"肺癌的化疗及分子靶向治疗,老年肺癌及各种实体瘤的综合治疗和自体干细胞移植术",,,,,,,,
赵赟博,北京,东城,北京医院,其他,肿瘤内科,主任医师,,3.3,11,肺癌、结直肠癌、乳腺癌、肝癌、胰腺癌、淋巴瘤等的诊治，特别是对新药的靶向治疗,"88,538次",0篇,11位,0位,0位,,,
艾斌,北京,东城,北京医院,其他,肿瘤内科,主任医师,,3.3,,肺癌、结直肠癌、恶性淋巴瘤及乳腺癌的化疗和分子靶向治疗，研究化疗耐药患者的治疗方法及抗血管新生药物在肿瘤治疗中的应用,,,,,,,,
刘焱,北京,东城,北京医院,其他,肿瘤内科,副主任医师,,3.2,,消化系统肿瘤的诊断、化疗、分子靶向治疗及微创介入诊断及治疗。,,,,,,,,
黄莹莹,北京,东城,北京医院,其他,肿瘤内科,副主任医师,,3.2,,各种癌症的化疗及免疫治疗,,,,,,,,
李旭,北京,东城,北京医院,其他,肿瘤内科,副主任医师,,3.2,,呼吸系统、泌尿系统肿瘤的诊治,"6,111次",0篇,0位,0位,0位,,,
李文举,北京,东城,北京医院,其他,肿瘤内科,副主任医师,,3.2,,肺癌、乳腺癌、淋巴瘤、肝癌、胃癌、结肠癌等各种实体瘤的术前、术后化疗、免疫及分子耙向治疗，以及各种晚期肿瘤的综合治疗，自体造血干细胞移植治疗实体肿瘤的工作，并与放射科合作，介入治疗肝癌、肺癌等实体瘤,,,,,,,,
乔昱,北京,东城,北京医院,其他,肿瘤内科,副主任医师,,3.2,3,消化道肿瘤，肺癌，乳腺癌等常见肿瘤,"4,417次",0篇,3位,0位,0位,,,
周美珍,北京,东城,北京医院,其他,肿瘤内科,主任医师,,3.2,,肿瘤化疗（肺癌、乳腺癌、恶性淋巴瘤、胃癌、大肠癌、肝癌）及免疫，中西结合等综合治疗，积累了丰富的临床经验,,,,,,,,
许佩珉,北京,东城,北京医院,其他,肿瘤内科,主任医师,,3.2,,,,,,,,,,
王晖,北京,东城,北京医院,其他,肿瘤内科,主任医师,,3.2,,各种癌症的化疗及免疫治疗,,,,,,,,
武晓楠,北京,东城,北京医院,其他,肿瘤内科,副主任医师,,3.2,56,肺癌诊治，免疫靶向治疗,,0篇,56位,2位,2位,,,
丁丽,北京,东城,北京医院,其他,肿瘤内科,副主任医师,,3.2,,熟练掌握乳腺癌、肺癌及结直肠肿瘤的化疗、靶向治疗及内分泌治疗.,,,,,,,,
张子瑾,北京,东城,北京医院,其他,肿瘤内科,副主任医师,,3.2,,消化道恶性肿瘤等实体瘤、癌痛药物治疗等方面。,,,,,,,,
张萍,北京,东城,北京医院,其他,肿瘤内科,副主任医师,,3.2,,擅长多种实体瘤的综合治疗．,,,,,,,,
唐敏,北京,东城,北京医院,其他,肿瘤内科,副主任医师,,3.2,6,常见恶性实体肿瘤（如肺癌、胃癌、结直肠癌等）的综合内科治疗（如化疗、靶向治疗、免疫治疗、和缓医疗等）,"7,249次",0篇,6位,0位,0位,,,
刘文博,北京,东城,北京医院,其他,肿瘤内科,主治医师,,3.1,,,,,,,,,,
赵云博,北京,东城,北京医院,其他,肿瘤内科,主任医师,,2.8,,,,,,,,,,
许焱,北京,东城,北京医院,其他,肿瘤内科,副主任医师,,2.8,,恶性肿瘤的诊断及综合治疗,,,,,,,,
胡雪晴,北京,东城,北京医院,其他,肿瘤内科,副主任医师,,2.8,,胸部、胃肠道、乳腺等常见部位肿瘤的诊治,,,,,,,,
李怡,北京,东城,北京医院,其他,中医科,主任医师,教授,3.4,,中西医结合诊治糖尿病、代谢综合征、高血压病等,,,,,,,,
王凌,北京,东城,北京医院,其他,中医科,主任医师,,3.3,,对糖尿病、高血压病、肾脏疾病、老年病、月经失调、内分泌紊乱等有较深的研究和独特的治疗方法,,,,,,,,
张军,北京,东城,北京医院,其他,中医科,主任医师,,3.2,2,治疗肾脏及泌尿系疾病、恶性肿瘤、糖尿病并发症、老年内科病、妇科病、皮肤病等。,"1,637次",0篇,2位,0位,0位,,,
高琰,北京,东城,北京医院,其他,中医科,主治医师,,3.2,97,脾胃病 消化系统疾病 冠心病 高血压 糖尿病 妇科病 老年病,"110,357次",12篇,97位,28位,29位,,,
李秋贵,北京,东城,北京医院,其他,中医科,主任医师,,3.1,,糖尿病及其并发症、泌尿生殖系病、内科杂病等病证的临床治疗,,,,,,,,
赵展荣,北京,东城,北京医院,其他,中医科,主任医师,,3.1,,治疗心脑血管疾病、肾病、糖尿病、慢支、哮喘、肿瘤等内科疑难杂病,,,,,,,,
张剑,北京,东城,北京医院,其他,中医科,主任医师,,3.1,,治疗各种老年病。在治疗老年慢性支气管炎、冠心病、老年抑郁、老年骨质疏松等方面积累了一定的临床经验,,,,,,,,
史学军,北京,东城,北京医院,其他,中医科,主任医师,,3.1,,中医治疗呼吸系统、消化系统、皮肤病、妇科疾病,,,,,,,,
魏玲玲,北京,东城,北京医院,其他,中医科,主任医师,,3.1,,在中西医结合治疗消化系统疾病，糖尿病及其并发症，风湿免疫病和妇科疾病等方面积累了一定的临床经验,,,,,,,,
李明瑞,北京,东城,北京医院,其他,中医科,主任医师,,3.1,,特别是在防治肿瘤，治疗老年各种急慢性呼吸系统疾病，心脑血管疾病，消化系统疾病，糖尿病，肾病，妇科病以及过敏性疾病等方面，取得显著成效,,,,,,,,
李晔,北京,东城,北京医院,其他,中医科,主任医师,,3.1,,中医诊治各种疾病,,,,,,,,
刘震,北京,东城,北京医院,其他,中医科,副主任医师,,3.0,,中西医结合治疗肾病，糖尿病、高血压病、老年病、肿瘤的临床,,,,,,,,
吴翥镗,北京,东城,北京医院,其他,中医科,副主任医师,,3.0,,中医治疗各种疾病如高血压、冠心病、糖尿病、内科杂症,,,,,,,,
闫小光,北京,东城,北京医院,其他,中医科,主治医师,,3.0,20,糖尿病、高血压病,"176,603次",8篇,20位,0位,0位,,,
王小岗,北京,东城,北京医院,其他,中医科,主治医师,,3.0,,,,,,,,,,
常婧舒,北京,东城,北京医院,其他,中医科,主治医师,,3.0,18,脾胃病，糖尿病，老年病，便秘。,"31,910次",0篇,18位,0位,0位,,,
黄飞,北京,东城,北京医院,其他,中医科,主治医师,,3.0,,,,,,,,,,
范婷,北京,东城,北京医院,其他,中医科,主治医师,,3.0,,,,,,,,,,
陈雪楠,北京,东城,北京医院,其他,中医科,主治医师,,3.0,,,,,,,,,,
王宝,北京,东城,北京医院,其他,中医科,主治医师,,3.0,,,,,,,,,,
乔琳琳,北京,东城,北京医院,其他,中医科,,,3.0,,,,,,,,,,
