王涛,北京,东城,北京协和医院,妇儿,妇科,副主任医师,,3.5,35,妇科良恶性肿瘤的诊断及规范化诊疗，妇科肿瘤手术，妇科腔镜手术，复发肿瘤的诊治,"23,871次",0篇,35位,0位,0位,,,
王巍,北京,东城,北京协和医院,妇儿,妇科,副主任医师,,3.5,,妇科疾病,"11,892次",0篇,0位,0位,0位,,,
杨玉雯,北京,东城,北京协和医院,妇儿,妇科,主任医师,,3.5,868,月经失调，更年期综合征，(围绝经期相关问题，40岁以上）普通妇科(子宫肌瘤，卵巢囊肿，子宫腺肌症等)以及不孕不育,"126,673次",0篇,868位,0位,0位,,,
范光升,北京,东城,北京协和医院,妇儿,妇科,主任医师,教授,3.4,,疾病性流产（如合并系统性红班狼疮、再生障碍性贫血、慢性肾炎、心脏病、癫痫等），必须终止早或中止妊娠的手术及畸形胎儿的引产、腹腔镜绝育及不孕检查等手术,,,,,,,,
马良坤,北京,东城,北京协和医院,妇儿,妇科,主任医师,教授,3.5,1704,对围产保健、产科的合并症和并发症，妊娠期糖尿病、妊娠合并甲状腺疾病以及危重处理、产科健康教育、妊娠期体重管理以及产科遗传咨询、羊水穿刺等产前筛查和诊断，对多囊卵巢综合征、卵巢早衰、围绝经期、孕前咨询等常见的妇科内分泌疾病，都有丰富的临床经验。,"2,943,245次",69篇,1704位,89位,112位,,,
于洁,北京,东城,北京协和医院,妇儿,妇科,主治医师,,3.4,,宫颈病变、宫颈糜烂、阴道病变、阴道癌、外阴病变、外阴癌、子宫内膜癌前病变、各种性病、各种阴道炎,,,,,,,,
彭澎,北京,东城,北京协和医院,妇儿,妇科,副主任医师,,3.4,1500,各种妇产科良、恶性疾病的诊治,"3,412,590次",117篇,1500位,0位,8位,,,
王永学,北京,东城,北京协和医院,妇儿,妇科,主治医师,,3.4,2139,宫颈HPV感染，宫颈癌前病变、宫颈癌的处理；子宫肌瘤，子宫内膜息肉的处理；卵巢囊肿等良性疾病；子宫内膜癌保留生育功能治疗，子宫内膜癌的手术治疗以及术后的辅助治疗；卵巢癌的诊治,"1,800,397次",4篇,2139位,6位,9位,,,
李彩娟,北京,东城,北京协和医院,妇儿,妇科,副主任医师,副教授,3.4,575,"宫颈疾病,性传播疾病,不孕不育,习惯性流产,特殊炎症,宫外孕,各种良性及恶性肿瘤","569,035次",4篇,575位,7位,44位,,,
李春颖,北京,东城,北京协和医院,妇儿,妇科,副主任医师,,3.4,,普通妇科、产科疾病的诊治,"33,213次",0篇,0位,0位,0位,,,
楼伟珍,北京,东城,北京协和医院,妇儿,妇科,主治医师,,3.4,,,,,,,,,,
仝佳丽,北京,东城,北京协和医院,妇儿,妇科,副主任医师,,3.4,,,,,,,,,,
范融,北京,东城,北京协和医院,妇儿,妇科,主治医师,,3.4,6,普通妇科，子宫肌瘤的非手术治疗,"40,225次",0篇,6位,5位,5位,,,
尹婕,北京,东城,北京协和医院,妇儿,妇科,副主任医师,,3.4,435,主要擅长阴道不规则出血、宫腔占位、宫颈癌前病变、HPV感染、卵巢良恶性肿瘤、子宫肌瘤、子宫恶性肿瘤、子宫内膜上皮内瘤变、子宫内膜异位症、妇科炎症等妇科疾病。,"340,057次",0篇,435位,6位,6位,,,
蒋芳,北京,东城,北京协和医院,妇儿,妇科,副主任医师,,3.4,,,,,,,,,,
孙崟,北京,东城,北京协和医院,妇儿,妇科,副主任医师,,3.4,,,,,,,,,,
罗敏,北京,东城,北京协和医院,妇儿,妇科,主治医师,,3.4,,,,,,,,,,
陈娜,北京,东城,北京协和医院,妇儿,妇科,主治医师,,3.4,45,普通妇科、女性生殖道畸形,"35,347次",3篇,45位,0位,0位,,,
赵红,北京,东城,北京协和医院,妇儿,妇科,主治医师,,3.4,,,,,,,,,,
曹杨,北京,东城,北京协和医院,妇儿,妇科,主治医师,,3.4,,,,,,,,,,
周莹,北京,东城,北京协和医院,妇儿,妇科,主治医师,,3.4,12,妇科相关疾病,"21,414次",0篇,12位,0位,0位,,,
吕嬿,北京,东城,北京协和医院,妇儿,妇科,主治医师,讲师,3.4,101,常见产科和妇科疾病,"131,833次",0篇,101位,0位,1位,,,
郭琦,北京,东城,北京协和医院,妇儿,妇科,主治医师,,3.4,,妊娠期糖尿病、妊娠期高血压疾病，产科规范检查、妇科常见病、不孕症,,,,,,,,
李源,北京,东城,北京协和医院,妇儿,妇科,主治医师,,3.4,,,,,,,,,,
史精华,北京,东城,北京协和医院,妇儿,妇科,主治医师,,3.4,,,,,,,,,,
商晓,北京,东城,北京协和医院,妇儿,妇科,主治医师,,3.4,48,妇产科常见疾病，包括：阴道炎，宫颈病变，HPV感染，子宫肌瘤，卵巢囊肿，妇科肿瘤化疗，孕期保健等,"4,102次",0篇,48位,0位,0位,,,
梁硕,北京,东城,北京协和医院,妇儿,妇科,主治医师,,3.4,,妇科常见疾病，包括生殖道炎症、外阴瘙痒、子宫肌瘤、卵巢囊肿、子宫内膜异位症、子宫腺肌症、宫颈病变、月经失调以及盆底功能障碍性疾病（尿失禁、子宫脱垂）的诊治。,,,,,,,,
李晓川,北京,东城,北京协和医院,妇儿,妇科,主治医师,,3.4,4,妇产科常见病、多发病的规范诊治。,"24,072次",0篇,4位,1位,2位,,,
娄文佳,北京,东城,北京协和医院,妇儿,妇科,主治医师,,3.4,,妇产科常见病、多发病的规范诊治；女性盆底功能障碍性疾病；女性性功能障碍等,,,,,,,,
张多多,北京,东城,北京协和医院,妇儿,妇科,住院医师,,3.3,230,妇科内分泌、辅助生殖、产前诊断,"144,333次",0篇,230位,34位,34位,,,
邱琳,北京,东城,北京协和医院,妇儿,妇科,住院医师,讲师,3.2,104,妇产科常见病 子宫肌瘤 卵巢囊肿 子宫内膜异位症 子宫腺肌症 月经失调更年期综合症 月经过多 月经减少 下腹疼痛 盆腔炎 外阴瘙痒 阴道炎 外阴白斑 不孕 妇科肿瘤,"67,629次",0篇,104位,11位,12位,,,
刘倩,北京,东城,北京协和医院,妇儿,妇科,主治医师,,3.2,,妇科常见良、恶性疾病的诊治,,,,,,,,
张志博,北京,东城,北京协和医院,妇儿,妇科,住院医师,,3.2,,,,,,,,,,
刘思邈,北京,东城,北京协和医院,妇儿,妇科,住院医师,,3.1,,妇产科常见疾病的诊治,,,,,,,,
宋晓晨,北京,东城,北京协和医院,妇儿,妇科,住院医师,,3.1,2033,宫颈病变、子宫肌瘤、卵巢肿瘤、子宫内膜异位症、异常子宫出血等妇科疾病的诊疗，孕前咨询,"2,319,142次",10篇,2033位,2位,4位,,,
杨华,北京,东城,北京协和医院,妇儿,妇科,住院医师,,3.1,,,,,,,,,,
王克芳,北京,东城,北京协和医院,妇儿,妇科,住院医师,,3.1,,,,,,,,,,
王丹,北京,东城,北京协和医院,妇儿,妇科,住院医师,,3.1,,,,,,,,,,
杨洁,北京,东城,北京协和医院,妇儿,妇科,住院医师,,3.1,,,,,,,,,,
计鸣良,北京,东城,北京协和医院,妇儿,妇科,住院医师,,3.1,,妇产科常见病、多发病的规范诊治。,,,,,,,,
刘虹,北京,东城,北京协和医院,妇儿,妇科,主管护师,,3.1,,,"4,760次",0篇,0位,0位,0位,,,
王轶男,北京,东城,北京协和医院,妇儿,妇科,住院医师,,3.1,,,,,,,,,,
王晓雨,北京,东城,北京协和医院,妇儿,妇科,住院医师,,3.1,9,妇科常见良恶性疾病的诊治,"6,997次",0篇,9位,0位,0位,,,
孙璐,北京,东城,北京协和医院,妇儿,妇科,住院医师,,3.1,,,,,,,,,,
刘玥,北京,东城,北京协和医院,妇儿,妇科,住院医师,,3.1,,,,,,,,,,
毛溯,北京,东城,北京协和医院,妇儿,妇科,,,3.1,,,,,,,,,,
吕昌帅,北京,东城,北京协和医院,妇儿,妇科,住院医师,,3.1,1,擅长各种妇科常见病及多发病的诊治。孕产妇产前咨询。计划生育相关问题咨询。妇科良性及恶性疾病的诊治。,"2,072次",0篇,1位,0位,0位,,,
薛薇,北京,东城,北京协和医院,妇儿,妇科,,,3.1,,,,,,,,,,
钞晓培,北京,东城,北京协和医院,妇儿,妇科,住院医师,,2.8,,,"2,312次",0篇,0位,0位,0位,,,
张国瑞,北京,东城,北京协和医院,妇儿,妇科,主治医师,,,,,,,,,,,,
宋红梅,北京,东城,北京协和医院,妇儿,儿科,主任医师,教授,3.7,340,小儿风湿免疫病，肾脏病，感染性疾病以及部分遗传性疾病，孩子的日常保健,"716,665次",5篇,340位,1位,29位,,,
李冀,北京,东城,北京协和医院,妇儿,儿科,副主任医师,,3.9,1458,系统性红斑狼疮、幼年型特发性关节炎、牛奶蛋白过敏、儿童矮小、儿童生长发育及儿童保健、免疫性血小板减少症、皮肌炎、过敏性紫癜、川崎病、风湿热、原发性免疫缺陷病、自身炎症性疾病、周期性发热、儿童不明原因发热、肾病综合征、肾小球肾炎,"522,229次",44篇,1458位,164位,171位,3,167例,140例
魏珉,北京,东城,北京协和医院,妇儿,儿科,主任医师,教授,3.7,2141,"儿童肾脏病, 如血尿，蛋白尿，肾病综合征，急性肾小球肾炎，慢性肾炎，过敏性紫癜，紫癜性肾炎，高尿钙症等。尤其擅长遗传性肾脏疾病的诊断治疗及产前咨询，比如：肾小管酸中毒，巴特综合征，Gitelman综合征，范可尼综合症等。
儿童风湿免疫性疾病，如系统性红斑狼疮,皮肌炎,儿童慢性关节炎,血管炎等。
遗传代谢性疾病，如肝豆状核变性,肝糖原贮积症等。","1,106,240次",9篇,2141位,51位,104位,,,
王丹华,北京,东城,北京协和医院,妇儿,儿科,主任医师,教授,3.6,217,新生儿呼吸急救、围产期缺氧缺血性损伤的防治、早产儿营养和系统管理、高危儿的发育评价和早期干预、NICU院内感染的监测与控制,"324,498次",1篇,217位,0位,2位,,,
肖娟,北京,东城,北京协和医院,妇儿,儿科,主任医师,教授,3.6,264,小儿内科的各种常见病及疑难病，尤其是儿童血液系统及肿瘤性疾病，如：各型贫血、特发性血小板减少性紫癜、过敏性紫癜、血友病、各种出血性疾病、血栓性疾病、淋巴瘤，颅内生殖细胞瘤等。,"234,868次",0篇,264位,0位,2位,,,
李正红,北京,东城,北京协和医院,妇儿,儿科,主任医师,教授,3.6,27,新生儿疾病、新生儿急救及重症监护、婴幼儿营养及常见疾病、胃肠动力性疾病、胃食管反流、炎症性肠病、牛奶蛋白过敏相关性消化系统疾病、周期性呕吐综合征、腹泻、慢性便秘等,"448,001次",1篇,27位,3位,4位,,,
邱正庆,北京,东城,北京协和医院,妇儿,儿科,主任医师,教授,3.6,94,遗传代谢性肝病（糖原累积症、肝豆状核变性等）的诊治和产前诊断，畸形综合症的诊断和咨询，儿科疑难病的诊断和咨询,,1篇,0位,0位,0位,,,
鲍秀兰,北京,东城,北京协和医院,妇儿,儿科,主任医师,教授,3.5,,"新生儿行为神经测查,小儿发育和早期教育,发育迟缓、肌张力异常、脑瘫问题，小儿甲状腺疾病,垂体侏儒,儿童矮小症",,,,,,,,
丁国芳,北京,东城,北京协和医院,妇儿,儿科,主任医师,教授,3.5,306,新生儿疾病、早产儿急救和管理、新生儿黄疸的诊断和治疗、婴儿营养和喂养、以及普通小儿内科疾病的诊治,"141,964次",1篇,306位,0位,4位,,,
董梅,北京,东城,北京协和医院,妇儿,儿科,主任医师,教授,3.5,27,小儿胃肠道疾病（包括腹胀、腹痛、厌食、恶心、呕吐、腹泻、便秘等）及婴幼儿胃肠营养咨询,"147,638次",0篇,27位,0位,2位,,,
王晨,北京,东城,北京协和医院,妇儿,儿科,副主任医师,,3.4,31,新生儿疾病、儿童保健、心理行为发育，运动发育落后，语言发育落后，自闭症。,"80,492次",3篇,31位,0位,0位,,,
何艳燕,北京,东城,北京协和医院,妇儿,儿科,副主任医师,副教授,3.3,63,小儿内科疾病诊治，特别是小儿原发和继发性肾脏病及儿童风湿免疫性疾病的诊治,"215,881次",0篇,63位,0位,0位,,,
万伟琳,北京,东城,北京协和医院,妇儿,儿科,副主任医师,副教授,3.3,893,小儿呼吸系统疾病诊治（支气管哮喘、慢性咳嗽、闭塞性毛细支气管炎、嗜酸性粒细胞性肺炎，过敏性鼻炎、婴幼儿喘息性疾病，反复呼吸道感染）；过敏性疾病（湿疹、食物过敏、荨麻疹、严重过敏反应）；早产儿慢性肺疾病，早产儿营养及系统管理，新生儿疾病。,"1,030,408次",0篇,893位,1位,21位,,,
简珊,北京,东城,北京协和医院,妇儿,儿科,主治医师,,3.2,111,儿科常见病、肾脏相关疾病,"29,071次",0篇,111位,0位,0位,,,
张玉,北京,东城,北京协和医院,妇儿,儿科,主治医师,,3.2,,,,,,,,,,
马明圣,北京,东城,北京协和医院,妇儿,儿科,主治医师,,3.1,9,先天遗传代谢病（如糖原累积病、Prader Willi综合征、肝豆状核变性、 Duchenne型肌营养不良症）以及神经系统免疫系统性疾病（如神经精神性狼疮、抗NMDAR脑炎）,"60,740次",0篇,9位,0位,3位,,,
全美盈,北京,东城,北京协和医院,妇儿,儿科,主治医师,,3.1,,,,,,,,,,
唐晓艳,北京,东城,北京协和医院,妇儿,儿科,主治医师,,3.1,75,小儿消化,"114,700次",0篇,75位,0位,1位,,,
王琳,北京,东城,北京协和医院,妇儿,儿科,主治医师,,3.1,,,,,,,,,,
张乐嘉,北京,东城,北京协和医院,妇儿,儿科,主治医师,,3.1,57,"新生儿儿保,重度新生儿抢救,新生儿以及婴儿营养,行为发育等","31,526次",0篇,57位,0位,0位,,,
苟丽娟,北京,东城,北京协和医院,妇儿,儿科,主治医师,,3.1,,,,,,,,,,
李卓,北京,东城,北京协和医院,妇儿,儿科,主治医师,,3.1,,,,,,,,,,
马菁苒,北京,东城,北京协和医院,妇儿,儿科,主治医师,,3.1,,,,,,,,,,
孙静,北京,东城,北京协和医院,妇儿,儿科,主管护师,,3.1,10,婴幼儿护理及喂养咨询。,"49,044次",0篇,10位,0位,0位,,,
孙建伟,北京,东城,北京协和医院,妇儿,儿科,主管护师,,3.1,,,,,,,,,,
冯淑菊,北京,东城,北京协和医院,妇儿,儿科,主管护师,,3.1,10,婴幼儿护理及喂养咨询。,"50,464次",0篇,10位,0位,0位,,,
杨帆,北京,东城,北京协和医院,妇儿,儿科,护师,,3.1,14,婴幼儿护理及喂养咨询,"59,767次",0篇,14位,0位,0位,,,
杨志丽,北京,东城,北京协和医院,妇儿,儿科,护师,,3.1,10,婴幼儿护理和喂养,"47,474次",0篇,10位,0位,0位,,,
连冬梅,北京,东城,北京协和医院,妇儿,儿科,主管护师,,3.1,4,婴幼儿护理和喂养咨询,"36,534次",0篇,4位,0位,0位,,,
王长燕,北京,东城,北京协和医院,妇儿,儿科,住院医师,,3.1,,,,,,,,,,
张梦奇,北京,东城,北京协和医院,妇儿,儿科,住院医师,,3.1,,,,,,,,,,
张朕杰,北京,东城,北京协和医院,妇儿,儿科,住院医师,,3.1,,对儿科常见病、多发病、疑难杂症的诊断和治疗积累了一定的经验，并能灵活运用国内外前沿知识解决临床问题。先后在国内外知名杂志发表数篇专业论文。,,,,,,,,
孙之星,北京,东城,北京协和医院,妇儿,儿科,住院医师,,3.1,,,,,,,,,,
丁娟,北京,东城,北京协和医院,妇儿,儿科,,,3.1,,,,,,,,,,
于仲勋,北京,东城,北京协和医院,妇儿,儿科,住院医师,,3.1,,,"2,490次",0篇,0位,0位,0位,,,
刘俊涛,北京,东城,北京协和医院,妇儿,产科,主任医师,教授,3.7,,产科危急重症的诊治；遗传咨询；绒毛活检、羊水穿刺和脐静脉穿刺等常用产前诊断技术；胎儿镜技术。,,,,,,,,
单莹,北京,东城,北京协和医院,妇儿,产科,副主任医师,,4.3,1964,"先兆流产，胚胎停育，孕期管理，产后出血，恶露，哺乳，相关问题。宫颈病变，阴道炎，HPV感染，宫颈息肉，子宫内膜息肉，子宫肌瘤，痛经，盆腔炎，巧囊，腺肌症，月经紊乱, 阴道出血，多囊卵巢，不孕，不育，卵巢癌，子宫内膜癌，宫颈癌，外阴癌，靶向治疗（尼拉帕尼，奥拉帕尼，PD-1等），ca125升高解读，妇科肿瘤影像CT等解读","347,753次",1篇,1964位,96位,100位,2,156例,132例
陶陶,北京,东城,北京协和医院,妇儿,产科,副主任医师,,4.2,5787,妇科常见病（宫颈病变，卵巢囊肿，子宫肌瘤），妇科内分泌相关问题（月经失调，更年期等），不孕不育，生殖及肿瘤遗传咨询，妊娠相关问题,"2,721,462次",68篇,5787位,1334位,1343位,4,1558例,1236例
宋英娜,北京,东城,北京协和医院,妇儿,产科,主任医师,教授,4.1,3139,诊断及处理各种高危妊娠、难产及常见的妊娠合并症、并发症；常见遗传性疾病的产前诊断及产前咨询,,0篇,3139位,570位,611位,3,615例,529例
钟逸锋,北京,东城,北京协和医院,妇儿,产科,副主任医师,,3.8,471,高危孕产妇管理，前置胎盘，妊娠高血压，妊娠糖尿病，瘢痕子宫妊娠，妊娠合并风湿免疫病，妊娠合并血液病，妊娠合并内分泌疾病，产前遗传咨询，产前诊断，瘢痕憩室，孕前咨询，孕期营养，孕期保健,"264,487次",7篇,471位,97位,101位,,,
高劲松,北京,东城,北京协和医院,妇儿,产科,主任医师,教授,3.8,1864,围产保健，产科合并症及并发症的处理、产前诊断技术（羊水穿刺、绒毛活检等）,"1,630,386次",3篇,1864位,46位,79位,,,
边旭明,北京,东城,北京协和医院,妇儿,产科,主任医师,教授,3.7,,高危妊娠包括内外科疾病合并妊娠、妊娠期和分娩期合并症等的处理,,,,,,,,
宋亦军,北京,东城,北京协和医院,妇儿,产科,主任医师,教授,3.6,259,围产医学、产前诊断,"431,011次",0篇,259位,0位,6位,,,
戚庆炜,北京,东城,北京协和医院,妇儿,产科,主任医师,副教授,3.6,,母胎医学、产前咨询、产前筛查和产前诊断,,,,,,,,
杨剑秋,北京,东城,北京协和医院,妇儿,产科,主任医师,教授,3.5,,高危孕产妇，各种产科并发症，及内外科合并症，难产等的临床处理,,,,,,,,
付晨薇,北京,东城,北京协和医院,妇儿,产科,主任医师,教授,3.5,,产科,,,,,,,,
马良坤,北京,东城,北京协和医院,妇儿,产科,主任医师,教授,3.5,1704,对围产保健、产科的合并症和并发症，妊娠期糖尿病、妊娠合并甲状腺疾病以及危重处理、产科健康教育、妊娠期体重管理以及产科遗传咨询、羊水穿刺等产前筛查和诊断，对多囊卵巢综合征、卵巢早衰、围绝经期、孕前咨询等常见的妇科内分泌疾病，都有丰富的临床经验。,"2,943,246次",69篇,1704位,89位,112位,,,
蒋宇林,北京,东城,北京协和医院,妇儿,产科,副主任医师,副教授,3.5,910,产前诊断、胎儿异常的诊治、遗传性疾病、双胎的围产期管理,"1,103,028次",0篇,910位,155位,164位,,,
周希亚,北京,东城,北京协和医院,妇儿,产科,副主任医师,副教授,3.5,,,,,,,,,,
张多多,北京,东城,北京协和医院,妇儿,产科,住院医师,,3.3,230,妇科内分泌、辅助生殖、产前诊断,"144,334次",0篇,230位,34位,34位,,,
汤萍萍,北京,东城,北京协和医院,妇儿,产科,主治医师,,3.4,387,专注于围产保健的管理，对孕前咨询、妊娠管理有丰富经验，对各种病理产科情况，如早产、妊娠期高血压等疾病的诊治也有深入研究。,"278,120次",9篇,387位,58位,58位,,,
胡惠英,北京,东城,北京协和医院,妇儿,产科,主治医师,,3.4,200,子宫肌瘤，卵巢囊肿，宫颈病变，子宫内膜异位症；异位妊娠，计划生育；产前筛查,"421,913次",1篇,200位,0位,0位,,,
周倩,北京,东城,北京协和医院,妇儿,产科,主治医师,讲师,3.4,49,产科咨询、围产期弓形虫筛查,"107,223次",0篇,49位,0位,0位,,,
李蕊,北京,东城,北京协和医院,妇儿,产科,副主任护师,,3.2,,母乳喂养过程中常见问题的指导及新生儿护理，咨询问题包括：.乳房肿胀、乳头疼痛、产后母乳不足，如何增加泌乳、产后妈妈追奶及新生儿脐带护理问题等。,"7,259次",0篇,0位,0位,0位,,,
王佩,北京,东城,北京协和医院,妇儿,产科,住院医师,,3.2,2,,"9,591次",0篇,2位,0位,0位,,,
景丹,北京,东城,北京协和医院,妇儿,产科,住院医师,,3.2,,,"6,947次",0篇,0位,0位,0位,,,
郁琦,北京,东城,北京协和医院,妇儿,妇科内分泌与生殖中心,主任医师,教授,3.8,19318,妇科内分泌，包括不育和试管婴儿、月经紊乱和多囊卵巢综合征、绝经相关疾病等。,"23,286,587次",7篇,19318位,35位,545位,,,
邓姗,北京,东城,北京协和医院,妇儿,妇科内分泌与生殖中心,主任医师,教授,4.7,7455,妇科内分泌：不孕与不育的生殖外科手术（擅长宫腔粘连、剖宫产瘢痕憩室、粘膜下肌瘤等宫腔镜手术治疗）；子宫腺肌症和子宫内膜异位症的全周期管理；异常子宫出血的药物治疗和手术管理；闭经的鉴别诊断；性分化异常与生殖道畸形；绝经期管理。,"5,680,295次",24篇,7455位,2103位,2285位,3,2815例,2267例
陶陶,北京,东城,北京协和医院,妇儿,妇科内分泌与生殖中心,副主任医师,,4.2,5787,妇科常见病（宫颈病变，卵巢囊肿，子宫肌瘤），妇科内分泌相关问题（月经失调，更年期等），不孕不育，生殖及肿瘤遗传咨询，妊娠相关问题,"2,721,464次",68篇,5787位,1334位,1343位,4,1558例,1236例
熊巍,北京,东城,北京协和医院,妇儿,妇科内分泌与生殖中心,主治医师,讲师,3.9,3302,"子宫内膜异位症、月经不调，多囊卵巢综合征，外阴白斑，妇科炎症，宫颈病变，妇科良性肿瘤（卵巢良性囊肿，子宫肌瘤），胚胎停育，围产咨询和保健,孕产指导；母乳喂养指导；","2,580,314次",34篇,3302位,0位,0位,2,1125例,817例
王亚平,北京,东城,北京协和医院,妇儿,妇科内分泌与生殖中心,主治医师,,4.0,7160,"各种月经失调,不孕，更年期激素替代治疗","4,622,962次",11篇,7160位,1488位,1635位,3,2057例,1354例
何方方,北京,东城,北京协和医院,妇儿,妇科内分泌与生殖中心,主任医师,教授,3.9,4918,试管婴儿技术治疗不孕症（IVF多次失败，卵巢早衰，多囊，子宫内膜异位症等）及其他妇科内分泌疾病。,"2,203,960次",65篇,4918位,209位,256位,,,
甄璟然,北京,东城,北京协和医院,妇儿,妇科内分泌与生殖中心,主任医师,副教授,3.7,1020,妇科内分泌，包括不孕不育和试管婴儿、月经紊乱和多囊卵巢综合征、高泌乳素血症、绝经相关疾病、性激素补充治疗等。,"481,800次",31篇,1020位,137位,156位,,,
田秦杰,北京,东城,北京协和医院,妇儿,妇科内分泌与生殖中心,主任医师,教授,3.7,3820,"性发育异常、性早熟、月经紊乱、多囊卵巢综合征、高泌乳素血症、不育、子宫肌瘤、卵巢囊肿和子宫内膜异位症的诊断、处理和宫腔镜、腹腔镜手术、更年期治疗、绝经后激素替代治疗等
He is good at diagnosis and management of disorders of sex development (DSD), precocious puberty, abnormal uterine bleeding (AUB), amenorrhea, polycystic ovarian syndrome (PCOS), hyperprolactinemia, infertility, leiomyoma, endometriosis, ovarian cysts, menopausal symptoms treatment and menopausal hormone therapy (MHT). He is skilled in laparoscopic and hysteroscopic examination and treatment.","2,602,142次",26篇,3820位,59位,164位,,,
徐苓,北京,东城,北京协和医院,妇儿,妇科内分泌与生殖中心,主任医师,教授,3.7,36,女性一生各阶段妇科内分泌疾病的诊治,"21,254次",0篇,36位,0位,0位,,,
陈蓉,北京,东城,北京协和医院,妇儿,妇科内分泌与生殖中心,主任医师,教授,3.6,3916,各种妇科内分泌疾病，如绝经、月经病、不育、PCOS、性发育异常等。,"5,288,682次",18篇,3916位,119位,328位,,,
孙爱军,北京,东城,北京协和医院,妇儿,妇科内分泌与生殖中心,主任医师,教授,3.6,734,不育及妇科相关手术,,7篇,734位,1位,71位,,,
邓成艳,北京,东城,北京协和医院,妇儿,妇科内分泌与生殖中心,主任医师,教授,3.6,,不孕、不育症、妇科内分泌疾病、多囊卵巢综合症的诊治,,,,,,,,
关源源,北京,东城,北京协和医院,妇儿,妇科内分泌与生殖中心,主任医师,教授,3.5,,检测排卵、促排卵、不孕不育的疾病的诊治,"16,494次",0篇,0位,0位,0位,,,
林守清,北京,东城,北京协和医院,妇儿,妇科内分泌与生殖中心,主任医师,教授,3.5,,"生殖内分泌失调,青春发育异常,月经紊乱,功能失调性不育,更年期问题及性激素水平异常,比例失调有关的各种身心障碍性疾病",,,,,,,,
张以文,北京,东城,北京协和医院,妇儿,妇科内分泌与生殖中心,主任医师,教授,3.5,,女性各种月经疾病、青春发育异常、性发育异常、更年期及绝经相关问题、及女性不育症的诊治,,,,,,,,
孙正怡,北京,东城,北京协和医院,妇儿,妇科内分泌与生殖中心,副主任医师,副教授,3.5,,不育症及辅助生育治疗（试管婴儿）、月经异常、更年期综合征的治疗,,,,,,,,
周远征,北京,东城,北京协和医院,妇儿,妇科内分泌与生殖中心,副主任医师,副教授,3.5,333,诊治月经失调、多囊卵巢综合征、绝经相关疾病、不育及行不育的辅助生殖治疗,"342,276次",0篇,333位,47位,59位,,,
王含必,北京,东城,北京协和医院,妇儿,妇科内分泌与生殖中心,副主任医师,副教授,3.4,28,妇科内分泌方面的疾病的诊治，包括各种月经紊乱、闭经、多囊卵巢综合征、高泌乳素血症、不育的诊断、处理，熟练掌握试管婴儿的卵泡监测及促排卵；更年期治疗、绝经后激素补充治疗等,"120,477次",0篇,28位,0位,23位,,,
