刘丹,北京,东城,北京同仁医院,外科,泌尿外科,主治医师,,3.0,,前列腺相关疾病 尿流动力学,"7,761次",0篇,0位,0位,0位,,,
闫伟,北京,东城,北京同仁医院,外科,泌尿外科,主治医师,,2.9,34,泌尿外科常见疾病,,0篇,0位,0位,0位,,,
关迪,北京,东城,北京同仁医院,外科,泌尿外科,主治医师,助教,2.8,,泌尿外科各种疾病诊疗 男性包皮炎，包皮过长治疗,,0篇,0位,0位,0位,,,
杜震,北京,东城,北京同仁医院,外科,泌尿外科,住院医师,,2.8,3,泌尿系结石，包皮炎，包皮过长，包茎，前列腺增生，前列腺炎，膀胱癌等疾病的诊治,"19,240次",0篇,3位,0位,0位,,,
于磊,北京,东城,北京同仁医院,外科,胸外科,主任医师,教授,3.5,1069,重症肌无力（胸腺瘤）、食管疾病及肺癌,"1,204,778次",56篇,1069位,4位,7位,,,
于涛,北京,东城,北京同仁医院,外科,胸外科,主任医师,,3.3,1215,胸腺瘤等纵隔肿瘤、重症肌无力、食管裂孔疝、贲门失弛缓等食管良性疾病、肺部小结节、肺癌、食管癌等胸部外科疾病的诊断及微创治疗,"995,992次",15篇,1215位,286位,293位,,,
蒋俭,北京,东城,北京同仁医院,外科,胸外科,主任医师,副教授,3.2,,肺癌、食管癌、食管良性疾病、纵隔肿瘤、重症肌无力等胸部外科疾病的诊断治疗；胸部肿瘤的规范化治疗及胸部微创治疗等,,,,,,,,
杨兴国,北京,东城,北京同仁医院,外科,胸外科,主治医师,,3.1,213,胸腺瘤，重症肌无力，肺结节，外科微创手术治疗,"96,848次",6篇,213位,182位,182位,,,
李飞,北京,东城,北京同仁医院,外科,胸外科,主治医师,,3.1,397,肺癌，食管癌，胸腺瘤，纵膈肿瘤，重症肌无力，食管裂孔疝等疾病的诊治。,"159,128次",0篇,397位,14位,17位,,,
李建业,北京,东城,北京同仁医院,外科,胸外科,主任医师,,3.0,,"胸部,食管良性疾病；气管肿瘤和气管良性狭窄等气管疾病",,,,,,,,
张云峰,北京,东城,北京同仁医院,外科,胸外科,主治医师,,2.9,1,肺结节，肺癌，食管癌，食管裂孔疝，纵膈肿瘤,"19,760次",0篇,1位,0位,0位,,,
马山,北京,东城,北京同仁医院,外科,胸外科,副主任医师,,2.8,,胸腔镜胸腺切除治疗重症肌无力，胸腔镜食管平滑肌瘤和纵隔肿瘤切除手术，胸腔镜下心房纤颤消融治疗，食管裂孔疝和贲门失弛缓的腹腔镜手术治疗，手汗症的微创手术治疗，肺癌晚期的各种姑息减症手术治疗,"69,636次",14篇,0位,0位,0位,,,
柯冀,北京,东城,北京同仁医院,外科,胸外科,主治医师,,2.8,300,胸腺瘤、重症肌无力、肺癌、肺部良性肿瘤、肺结节、胸部创伤、气胸的外科治疗。,"808,888次",2篇,300位,170位,170位,,,
张葆勋,北京,东城,北京同仁医院,外科,胸外科,主治医师,,2.8,14,"胸腺瘤，重症肌无力
气胸，肺大泡
食管裂孔疝，返流性食管炎，贲门失弛缓
肺部及食管肿瘤","32,086次",0篇,14位,4位,5位,,,
余振,北京,东城,北京同仁医院,外科,胸外科,主治医师,讲师,2.8,,食管癌，肺癌，重症肌无力,"23,301次",0篇,0位,0位,0位,,,
张明珠,北京,东城,北京同仁医院,外科,足踝外科中心,主任医师,教授,4.3,827,足踝部畸形矫正，包括足拇外翻，扁平足，高弓足等畸形，足踝骨折并发症、后遗症等治疗；足踝部创伤，包括踝关节骨折、跟骨骨折、距骨骨折、跖骨骨折、Lisfranc损伤，跟腱断裂等；足踝运动损伤，包括踝关节炎，踝关节痛，距下关节炎，踝关节扭伤，距骨软骨损伤、踝关节外侧副韧带损伤和夏科氏足诊治。,"414,411次",47篇,827位,282位,284位,2,393例,170例
张树,北京,东城,北京同仁医院,外科,足踝外科中心,主治医师,,5.0,1189,拇外翻，足趾畸形，甲沟炎，复发的拇趾腱鞘囊肿，踝扭伤；平足症等,"200,475次",17篇,1189位,746位,757位,3,781例,596例
王智,北京,东城,北京同仁医院,外科,足踝外科中心,主治医师,,4.7,1142,擅长足踝外科的前足手术，主要研究方向是拇外翻前足畸形、足踝运动损伤、平足畸形、以及各类高弓足的治疗和矫正、足踝创伤后遗症的治疗。,"466,162次",8篇,1142位,715位,719位,2,720例,547例
张建中,北京,东城,北京同仁医院,外科,足踝外科中心,主任医师,教授,4.2,7567,足踝畸形、拇外翻、前足畸形、复杂足踝外科关节炎、平足症、高弓马蹄足畸形、神经肌肉疾病引发的足踝部畸形、足踝外科创伤及创伤后遗症、足踝部运动损伤等足踝外科疾病,"7,642,097次",29篇,7567位,1092位,1175位,2,3184例,972例
毛威,北京,东城,北京同仁医院,外科,足踝外科中心,主治医师,讲师,4.1,5475,"各类型拇外翻，马蹄足，马蹄内翻足，扁平足，类风湿关节炎，各种足部疼痛及其足踝外科疾病的矫形手术，
骨髓炎，包括化脓性骨髓炎，硬化性骨髓炎以及骨关节感染的中西医治疗。
足部功能性鞋垫制作。","5,326,243次",50篇,5475位,1288位,1312位,,,
孙超,北京,东城,北京同仁医院,外科,足踝外科中心,主任医师,,3.6,1627,足踝外科；拇外翻；扁平足；马蹄内翻足；踝关节运动损伤；跟腱疾病；骨性关节炎；类风湿足；足踝外伤等,"1,760,899次",14篇,1627位,53位,83位,,,
曲峰,北京,东城,北京同仁医院,外科,足踝外科中心,副主任医师,,3.5,117,主要方向为足踝外科、运动损伤、足踝部退行性疾患，包括足踝部扭伤、软骨损伤、撞击、跟腱损伤、踝关节炎等，擅长关节镜微创治疗足踝损伤。,"37,097次",0篇,117位,52位,52位,,,
李海涛,北京,东城,北京同仁医院,外科,足踝外科中心,主治医师,讲师,3.4,1499,拇外翻、扁平足、踝部骨折、踝部扭伤、跟腱断裂、足部骨折、高弓足内翻等足踝外科疾病,"5,000,021次",1篇,1499位,122位,130位,,,
魏芳远,北京,东城,北京同仁医院,外科,足踝外科中心,副主任医师,,3.3,1920,1. 足部畸形及发育异常：前足（拇外翻，拇内翻，锤状趾，交叉趾，并趾，多趾，类风湿性关节炎前足畸形）；中后足（高弓足，平足，马蹄内翻足）。2. 足部疼痛证候群：包括足部痛风，跖痛症，跟痛症，跖腱膜炎，足部复杂区域疼痛综合症。3.足踝部退行性疾患：包括拇僵硬，中足骨性关节炎，Muller-Weiss病，踝关节炎及距下关节炎，慢性跟腱炎；4.足踝创伤及运动性损伤：包括足踝部骨折，草地趾，Lisfranc损伤，踝关节扭伤，慢性踝关节不稳定，踝关节韧带损伤，距骨软骨损伤。5.足踝疾患的生物物理治疗：包括应用自体富血小板血浆（PRP）及冲击波治疗各种足踝退行性疼痛病变及骨不愈合。,"1,434,702次",4篇,1920位,368位,383位,,,
王显军,北京,东城,北京同仁医院,外科,足踝外科中心,副主任医师,,3.3,70,足踝疾病的诊治,"110,322次",1篇,70位,4位,6位,,,
焦守斐,北京,东城,北京同仁医院,外科,肝胆外科,主治医师,,3.5,906,肝胆外科疾病，比如胆囊息肉、胆囊腺肌症、胆囊结石、肝内胆管结石、胆总管结石、胆管炎、胰腺炎、肝癌、胆囊癌、胆管癌、胰腺癌、胰腺内分泌肿瘤、门静脉高压症等；以及其他普外科疾病，如胃肠道肿瘤、甲状腺结节、阑尾炎、腹股沟疝、皮肤肿物等。熟悉内科常见疾病的诊治。,"449,892次",34篇,906位,592位,600位,2,599例,398例
夏峰,北京,东城,北京同仁医院,外科,肝胆外科,主任医师,教授,3.4,1832,"1、肝胆胰脾疑难疾患的诊断及治疗
2、肝胆胰脾良恶性疾病的诊断治疗
3、胆石症（胆囊结石、肝内胆管结石、 肝外胆管结石）的个体化微创治疗
4、胆囊良恶性疾病（胆囊息肉、胆囊腺肌症、胆囊腺瘤、胆囊癌）等个体化微创治疗
4、胆胰疾病的内镜治疗（ERCP）
5、肝胆外科腹腔镜、十二指肠镜、 胆道镜诊断与治疗
6、肝胆胰脾恶性肿瘤的放化疗、靶向治疗、射频消融等治疗","1,064,577次",59篇,1832位,1187位,1196位,,,
计嘉军,北京,东城,北京同仁医院,外科,肝胆外科,主任医师,副教授,3.2,3772,常规开展肝胆脾胰肿瘤和胆结石微创治疗，擅长腹腔镜治疗肝胆脾胰恶性和良性疾病。擅长完全腹腔镜下肝脏、脾脏、胰腺切除术（腹腔镜保留脾脏胰腺手术、腹腔镜单独尾状叶切除）。优选胆石症患者的个体化微创治疗方案（腹腔镜胆管探查三种手术入路优化选择、两孔或三孔腹腔镜下胆总管探查取石、单孔腹腔镜手术、免气腹腹腔镜手术、肝内外胆管结石ptcs治疗，胆道镜下碎石、微创经口取石等）,"6,015,023次",38篇,3772位,622位,665位,,,
李冠群,北京,东城,北京同仁医院,外科,肝胆外科,主治医师,讲师,3.2,236,肝脏、胰腺的良恶性肿瘤手术治疗，胆囊结石、胆总管结石及梗阻性黄疸的手术、腹腔镜及内镜（ERCP）治疗。,"135,016次",4篇,236位,201位,201位,,,
张立军,北京,东城,北京同仁医院,外科,肝胆外科,主任医师,副教授,3.2,,肝胆、胰腺疾病的诊疗,"11,912次",0篇,0位,0位,0位,,,
许英晨,北京,东城,北京同仁医院,外科,肝胆外科,副主任医师,讲师,3.2,1230,肝胆胰常见疾病的诊断和治疗,"813,644次",15篇,1230位,426位,441位,,,
付建柱,北京,东城,北京同仁医院,外科,肝胆外科,主任医师,,3.1,187,擅长各类肝胆胰疾病的外科治疗，尤其擅长腹腔镜、胆道镜、十二指肠镜等肝胆外科微创治疗手段。在对各种良性病如胆囊结石，胆囊息肉，胆管结石，胆管炎、胆道狭窄等；恶性病如肝癌，胰腺癌，胆管癌的外科治疗方面有较高水平。,"274,882次",22篇,187位,64位,64位,,,
刘杰,北京,东城,北京同仁医院,外科,肝胆外科,主治医师,,3.0,29,肝胆胰疾病的诊治等,"10,278次",0篇,29位,0位,0位,,,
张东欣,北京,东城,北京同仁医院,外科,肝胆外科,主治医师,,2.9,299,肝胆胰外科常见病的诊治。肝癌、胆管癌、胰腺癌的外科手术治疗；胆囊结石、胆总管结石的腹腔镜治疗；肝胆管结石病、胆管囊性扩张症、胰腺囊性肿瘤以及脾脏病变的外科治疗；肝胆外科复杂病例的手术安全性及可行性评估。,"110,971次",10篇,299位,266位,266位,,,
张庆余,北京,东城,北京同仁医院,外科,肝胆外科,副主任医师,,2.8,,肝胆胰腺疾病的诊断和治疗；腹腔镜手术,,,,,,,,
吴明营,北京,东城,北京同仁医院,外科,心血管外科,主任医师,教授,3.3,8,冠心病、瓣膜病、复杂先天性心脏病、胸主动脉瘤的诊断和外科治疗,"35,335次",0篇,8位,6位,6位,,,
袁彪,北京,东城,北京同仁医院,外科,心血管外科,主任医师,教授,3.3,7,冠心病、老年瓣膜病、房颤的外科治疗、心脏移植 先心病等,"36,480次",0篇,7位,0位,0位,,,
周自强,北京,东城,北京同仁医院,外科,心血管外科,主治医师,,3.0,2,冠心病 瓣膜病 高血压 房颤 心率失常,"14,233次",0篇,2位,1位,1位,,,
崔华楠,北京,东城,北京同仁医院,外科,心血管外科,副主任医师,,2.9,1,冠心病、瓣膜病、先心病的外科治疗，危急重症患者抢救及术后监护，心外术后患者康复治疗。,"12,854次",2篇,1位,1位,1位,,,
齐弘炜,北京,东城,北京同仁医院,外科,心血管外科,副主任医师,,2.9,4,先天性心脏病、瓣膜病、全动脉化冠脉搭桥手术，尤其是婴幼儿先心病、先心病外科介入治疗、特殊部位室缺经胸封堵、合并重度肺动脉高压先心病的治疗,"90,152次",22篇,4位,0位,0位,,,
吴文波,北京,东城,北京同仁医院,外科,心血管外科,主治医师,,2.9,8,冠心病外科治疗，术后抗凝治疗,"17,868次",0篇,8位,4位,4位,,,
陈楠,北京,东城,北京同仁医院,外科,心血管外科,主治医师,讲师,2.8,11,心脏疾病的外科治疗，包括冠心病、常见先天性心脏病、心脏瓣膜病、大血管疾病。,"50,348次",0篇,11位,1位,1位,,,
赵建刚,北京,东城,北京同仁医院,外科,心血管外科,主治医师,,2.8,,心外科疾病诊治,,,,,,,,
王妍军,北京,东城,北京同仁医院,外科,心血管外科,主治医师,,2.8,5,冠心病外科治疗 心脏瓣膜病 先天性心脏病,"21,943次",0篇,5位,5位,5位,,,
郁正亚,北京,东城,北京同仁医院,外科,血管外科,主任医师,教授,3.3,41,"1.急、慢性下肢动脉闭塞性疾病的治疗，包括外科手术和血管腔内介入治疗。下肢动脉硬化闭塞症（主髂动脉闭塞、股腘动脉闭塞等）的治疗、血栓闭塞性脉管炎、动脉血栓栓塞等外科治疗等；糖尿病合并下肢缺血的综合治疗。
2.大动脉疾病的外科手术和血管腔内微创治疗。
3.各种静脉疾病，包括静脉曲张微创手术以及静脉血栓栓塞性疾病的手术和介入治疗等。
颈动脉疾病的外科治疗，包括颈动脉狭窄外科手术和介入治疗、颈动脉体瘤、颈部副神经节瘤的外科手术治疗
4.疑难血液透析通路的建立、评估、翻修、重建。
5.其他普外科疾病的治疗。","163,930次",2篇,41位,0位,4位,,,
谭正力,北京,东城,北京同仁医院,外科,血管外科,副主任医师,,3.2,111,血管外科常见疾病，下肢静脉曲张的微创治疗；下肢动脉硬化闭塞症的手术及介入治疗；糖尿病足的综合治疗及复杂创面、慢性伤口的治疗；颈动脉的手术及介入治疗，下肢深静脉血栓一体化治疗，腹主动脉瘤的手术及腔内治疗，血管外伤的治疗，血管瘤的治疗，复杂血液透析通路的建立及并发症的处理。,"41,936次",0篇,111位,74位,75位,,,
缪鹏,北京,东城,北京同仁医院,外科,血管外科,主治医师,,3.0,479,周围血管外科疾病，血液透析通路的建立、维护及翻修手术,"798,325次",19篇,479位,95位,96位,,,
姚辰亮,北京,东城,北京同仁医院,外科,血管外科,住院医师,,2.8,,外周血管疾病的诊治,"7,627次",0篇,0位,0位,0位,,,
田然,北京,东城,北京同仁医院,外科,血管外科,主治医师,,2.8,2,糖尿病足（急、慢性伤口），尿毒症血液透析通路建立（动静脉内瘘、透析导管），下肢静脉曲张，深静脉血栓，周围动脉硬化闭塞症（下肢动脉、颈动脉）,,0篇,0位,0位,0位,,,
陈欣,北京,东城,北京同仁医院,外科,血管外科,主治医师,,2.8,26,下肢静脉曲张的综合性诊疗，通过微创手术（超声引导下静脉腔内射频消融闭合术 RFiTT）在诊断早期加以干预，鼓励患者术后定期门诊随访，通过复诊时的彩色多普勒超声检查了解术后患者的股隐交汇处返流情况，综合评估术后预后，加强手术疗效的维持，持续提升患者生活质量。,"19,699次",1篇,26位,24位,24位,,,
马涛,北京,东城,北京同仁医院,外科,整形美容中心,副主任医师,,2.9,178,精细重睑术、开大眼角、精细眼袋去除、精确鼻整形、吸脂塑身、微创除皱。面部精细注射轮廓雕塑，尤其擅长注射、激光、手术综合抗衰老治疗。,"215,640次",9篇,178位,23位,23位,,,
许莲姬,北京,东城,北京同仁医院,外科,整形美容中心,主治医师,,3.2,1774,眼部、鼻部、面部综合年轻化，瘢痕修复及私处整形,"485,590次",8篇,1774位,1位,1位,,,
韩新鸣,北京,东城,北京同仁医院,外科,整形美容中心,主治医师,,2.9,759,"综合应用手术、注射、激光等多种手段完成美容年轻化治疗，以达到最佳效果。特别是对精细眼、鼻整形手术、自体脂肪面部移植、无创面部微整形有丰富经验。
1：精细眼、鼻美容手术：个性化双眼皮成形（埋线法、切开法、三点小切口），微创内眼角开大，眼袋去除，上睑松弛矫正，个性化隆鼻、鼻尖改型。
2：自体脂肪面部移植：面部轮廓塑形（丰额头、太阳穴、苹果肌、法令纹、下颌），面部年轻化，上睑凹陷矫正
3：无创面部微整形：Botox注射瘦脸、除皱；玻尿酸注射除皱、隆鼻、隆颌、面部轮廓塑形；激光去各种黑痣、色斑。","1,399,014次",17篇,759位,0位,1位,,,
张君毅,北京,东城,北京同仁医院,外科,整形美容中心,主治医师,,2.9,3,各种类型瘢痕，瘢痕疙瘩、增生性瘢痕的综合治疗。各种体表肿物、皮肤恶性肿瘤修复。,737次,0篇,3位,1位,1位,,,
陈妍明,北京,东城,北京同仁医院,外科,整形美容中心,住院医师,,2.8,2,,440次,0篇,2位,0位,0位,,,
张开通,北京,东城,北京同仁医院,外科,乳腺中心,主治医师,,2.9,,乳腺癌及乳房良性疾病的规范化诊治。在乳腺腔镜手术、乳腺癌的保乳手术、乳腺癌根治同期乳房再造、腋窝前哨淋巴结活检、中心静脉输液泵植入，以及化疗、内分泌治疗、靶向治疗等方面，均有丰富的经验。注重治疗的个体化及康复，从根本上改善患者生活质量,"4,884次",0篇,0位,0位,0位,,,
翟建军,北京,东城,北京同仁医院,妇儿,妇产科,主任医师,教授,3.3,885,"妇科肿瘤微创手术。擅长腔镜手术的操作，如腹腔镜下子宫肌瘤剔除，宫颈癌根治手术，卵巢癌以及子宫内膜癌的手术。擅长晚期肿瘤化疗靶向治疗。
全国最新推出手术后疼痛问题完美解决方案，让手术患者彻底避免不必要围手术期疼痛。","1,538,292次",29篇,885位,28位,33位,,,
黄鲁,北京,东城,北京同仁医院,妇儿,妇产科,主治医师,讲师,3.0,22,妇科常见病，产科产检，妇科内分泌及不孕不育,"23,643次",0篇,22位,0位,0位,,,
田秀兰,北京,东城,北京同仁医院,妇儿,妇产科,副主任医师,,2.9,3,"妇科内分泌，妇科肿瘤。妇科的阴道镜、LEEP、宫腔镜、腹腔镜。
产科高危妊娠和产时危重症的处理如紧急剖宫产、产后出血、妊娠高血压疾病、妊娠期糖尿病。
各种计划生育手术如上环、取环、人工流产、中期妊娠引产、绝育术等","31,586次",0篇,3位,1位,3位,,,
孙晋萍,北京,东城,北京同仁医院,妇儿,妇产科,副主任医师,,2.9,2,产科相关,"15,884次",0篇,2位,0位,0位,,,
蔡昱,北京,东城,北京同仁医院,妇儿,妇产科,副主任医师,,2.9,,宫颈病变、月经紊乱及妇科肿瘤的诊治和腔镜微创手术及阴式手术。另外对产科并发症、合并症尤其复发性流产的保胎治疗及危重症等高危孕产妇的处理,,,,,,,,
于飞,北京,东城,北京同仁医院,妇儿,妇产科,副主任医师,讲师,2.8,7,妇科良恶性肿瘤的诊治及妇科内分泌诊疗,"40,551次",0篇,7位,1位,1位,,,
王慧香,北京,东城,北京同仁医院,妇儿,妇产科,副主任医师,,2.8,,,,,,,,,,
刘素霞,北京,东城,北京同仁医院,妇儿,妇产科,副主任医师,,2.8,,妇科内分泌,,,,,,,,
初幸之,北京,东城,北京同仁医院,妇儿,妇产科,副主任医师,,2.8,,子宫出血、子宫内膜息肉、子宫粘膜下肌瘤、子宫畸形、宫腔内异物的检查、诊断、治疗,,,,,,,,
郑桂芝,北京,东城,北京同仁医院,妇儿,妇产科,主治医师,,2.8,,阴道镜,,,,,,,,
闻静,北京,东城,北京同仁医院,妇儿,妇产科,主治医师,讲师,2.8,144,擅长宫颈病变得诊治、HPV感染的临床干预；妇科常见病如：子宫肌瘤、卵巢囊肿、宫腔占位的腹腔镜、宫腔镜手术；妇科阴道镜、leep手术操作。,"137,953次",0篇,144位,56位,61位,,,
侯萌,北京,东城,北京同仁医院,妇儿,妇产科,主治医师,,2.8,937,优生优育、产前筛查、遗传咨询、高危妊娠、复发性流产等,"1,115,555次",0篇,937位,1位,4位,,,
曹京红,北京,东城,北京同仁医院,妇儿,妇产科,主治医师,,2.8,,,,,,,,,,
潘燕,北京,东城,北京同仁医院,妇儿,妇产科,主治医师,,2.8,1,,"15,916次",0篇,1位,0位,0位,,,
王婷婷,北京,东城,北京同仁医院,妇儿,妇产科,主治医师,,2.8,,,,,,,,,,
战媛,北京,东城,北京同仁医院,妇儿,妇产科,主治医师,,2.8,18,子宫内膜异位症，薄型子宫内膜，妇科炎症，妇科肿瘤，妇产科超声检查，计划生育,"65,236次",0篇,18位,4位,4位,,,
肖巍,北京,东城,北京同仁医院,妇儿,妇产科,主治医师,,2.8,,,,,,,,,,
赵化芳,北京,东城,北京同仁医院,妇儿,妇产科,主治医师,,2.8,4742,"妇科：炎症/宫颈病变/内分泌/肿瘤诊治
产科：孕前咨询/孕期保健/产科合并症处理
计划生育","3,862,821次",2篇,4742位,27位,31位,,,
何川,北京,东城,北京同仁医院,妇儿,妇产科,主治医师,,2.8,,,,,,,,,,
许婵,北京,东城,北京同仁医院,妇儿,妇产科,住院医师,,2.8,20,妇科炎症，产前检查，子宫肌瘤,"44,580次",0篇,20位,0位,0位,,,
田星月,北京,东城,北京同仁医院,妇儿,妇产科,住院医师,,2.8,18,妊娠期糖尿病管理 孕期管理 分娩注意事项 早孕期保胎,"6,505次",0篇,18位,0位,0位,,,
黄东生,北京,东城,北京同仁医院,妇儿,儿科,主任医师,教授,3.3,83,白血病、淋巴瘤、神经母细胞瘤、视网膜母细胞瘤、肾母细胞瘤、横纹肌瘤、骨肉瘤、朗格罕氏组织细胞增生症、再生障碍性贫血、血小板减少性紫癜、MDS及各类溶血、贫血性疾病。同时兼顾小儿内分泌、呼吸、肾脏、心脏、消化、风湿等疾病的诊治,"106,560次",0篇,83位,0位,0位,,,
娜琪,北京,东城,北京同仁医院,妇儿,儿科,主任医师,,3.4,69,儿科临床业务全面，经验丰富。擅长1、儿童各系统常见病诊治；2、儿童呼吸系统疾病、哮喘、过敏性鼻炎和婴幼儿过敏性疾病的诊治；3、新生儿各系统常见病、疑难杂病的诊疗；4、儿童保健、儿童生长发育、神经心理行为障碍的评估和防治指导。,"142,008次",0篇,69位,3位,4位,,,
吴昱东,北京,东城,北京同仁医院,妇儿,儿科,主任医师,教授,3.3,,小儿肾脏疾病、呼吸道疾病,,,,,,,,
张谊,北京,东城,北京同仁医院,妇儿,儿科,副主任医师,副教授,3.2,,儿科常见病、新生儿疾病、危重症、儿童血液肿瘤以及干细胞移植的诊断及治疗,,,,,,,,
郑秀瑾,北京,东城,北京同仁医院,妇儿,儿科,主任医师,副教授,3.1,,小儿内科常见病、小儿心血管疾病的诊治、小儿健康咨询及心理咨询,,,,,,,,
马京琪,北京,东城,北京同仁医院,妇儿,儿科,主任医师,副教授,3.1,,小儿呼吸道疾病、反复呼吸道感染的防治,,,,,,,,
傅天真,北京,东城,北京同仁医院,妇儿,儿科,主任医师,副教授,3.1,2,小儿血液，肿瘤，新生儿,"49,895次",0篇,2位,0位,1位,,,
葛伟琦,北京,东城,北京同仁医院,妇儿,儿科,副主任医师,副教授,3.0,,新生儿窒息、新生儿缺氧缺血性脑病、肺炎、败血症的抢救,,,,,,,,
胡慧敏,北京,东城,北京同仁医院,妇儿,儿科,副主任医师,,2.9,,小儿内科疾病诊治，包括呼吸、神经、消化、血液肿瘤、心血管及新生儿,,,,,,,,
魏红,北京,东城,北京同仁医院,妇儿,儿科,副主任医师,,2.9,,小儿脑瘫诊断；小儿脑瘫诊断,"31,246次",0篇,0位,0位,0位,,,
李卫红,北京,东城,北京同仁医院,妇儿,儿科,副主任医师,,2.9,,小儿消化系统疾病,,,,,,,,
梁昱,北京,东城,北京同仁医院,妇儿,儿科,副主任医师,,2.9,,儿科营养及保健、儿科呼吸道系统疾病的冶疗,,,,,,,,
顾华丽,北京,东城,北京同仁医院,妇儿,儿科,主治医师,,2.8,,恶性肿瘤以及新生儿疾病,"9,369次",0篇,0位,0位,0位,,,
刘爱平,北京,东城,北京同仁医院,妇儿,儿科,主治医师,,2.8,,,,,,,,,,
张品伟,北京,东城,北京同仁医院,妇儿,儿科,主治医师,,2.8,,,,,,,,,,
冯碧波,北京,东城,北京同仁医院,妇儿,产科,主任医师,副教授,3.3,,妇科腔镜手术操作，妇产科疑难急症的诊断及处理；高危妊娠、妇科肿瘤、子宫内膜异位症的诊断及处理,,,,,,,,
付玉静,北京,东城,北京同仁医院,妇儿,产科,主任医师,,3.2,,围产期保健、妊娠合并免疫性疾病的治疗保健,,,,,,,,
冯冲,北京,东城,北京同仁医院,妇儿,产科,副主任医师,,3.1,9,妊娠相关问题的解答，产科合并症，分娩选择，妇科炎症，妇科肿瘤咨询，月经紊乱，异常出血的诊治,"45,258次",0篇,9位,0位,0位,,,
谷晔红,北京,东城,北京同仁医院,妇儿,产科,副主任医师,,3.0,,高危妊娠、妊娠糖尿病、妊娠合并甲状腺疾病的诊治,,,,,,,,
田秀兰,北京,东城,北京同仁医院,妇儿,产科,副主任医师,,2.9,3,"妇科内分泌，妇科肿瘤。妇科的阴道镜、LEEP、宫腔镜、腹腔镜。
产科高危妊娠和产时危重症的处理如紧急剖宫产、产后出血、妊娠高血压疾病、妊娠期糖尿病。
各种计划生育手术如上环、取环、人工流产、中期妊娠引产、绝育术等","31,587次",0篇,3位,1位,3位,,,
张春凤,北京,东城,北京同仁医院,妇儿,产科,副主任医师,,2.9,,常见病（子宫肌瘤、附件肿物、宫颈病变），各种炎症（各种阴道炎症、宫颈炎症、附件炎、盆腔炎症）的诊治,,,,,,,,
赵莲,北京,东城,北京同仁医院,妇儿,产科,副主任医师,,2.9,,高危妊娠管理、常见妇科疾病的治疗,,,,,,,,
林燕,北京,东城,北京同仁医院,妇儿,产科,主治医师,,2.8,,产科专台,,,,,,,,
张季媛,北京,东城,北京同仁医院,妇儿,计划生育科,副主任医师,,2.8,,计划生育和紧急避孕,,,,,,,,
